{
  "$schema": "https://json-schema.org/draft/2020-12/schema",
  "$id": "https://github.com/codeoritdidnthappen/frontdoor/blob/main/src/frontdoor/capture_sidecar.schema.json",
  "title": "Capture sidecar",
  "description": "One record per capture, written by the capture app at the shutter press. Shape defined in ARCHITECTURE.md section 4. Records what was captured, never what was computed.",
  "type": "object",
  "properties": {
    "capture_id": {
      "type": "string",
      "minLength": 1
    },
    "entrance_id": {
      "type": "string",
      "pattern": "^E-[0-9]{3}(?![\\s\\S])",
      "description": "Canonical entrance ID: E- followed by exactly three digits (NFC, no surrounding whitespace). Same rule as frontdoor.split.canonical_entrance_id. Anchored with (?![\\s\\S]) rather than $ so a trailing newline is rejected under both Python re and ECMA-262 (TICK-229)."
    },
    "captured_at": {
      "type": "string",
      "format": "date-time",
      "pattern": "^[0-9]{4}-[0-9]{2}-[0-9]{2}T[0-9]{2}:[0-9]{2}:[0-9]{2}(\\.[0-9]+)?Z(?![\\s\\S])",
      "description": "UTC RFC 3339 timestamp. Z is required; offsets are rejected so capture time has one spelling. Format assertion is enabled in validate_sidecar (rfc3339-validator). Anchored with (?![\\s\\S]) rather than $ so a trailing newline is rejected under both Python re and ECMA-262 (TICK-229)."
    },
    "device_model": {
      "type": "string",
      "minLength": 1
    },
    "lens": {
      "description": "The OPTICS that took the picture, e.g. builtInWideAngleCamera. Fixed at the 1x main lens by D-014. Not the same thing as capture_device: on a virtual device the main lens is reached through a device of another name, at that device's switch-over zoom factor.",
      "type": "string",
      "minLength": 1
    },
    "image": {
      "type": "object",
      "properties": {
        "path": {
          "type": "string",
          "minLength": 1
        },
        "sha256": {
          "$ref": "#/$defs/sha256"
        },
        "width": {
          "type": "integer",
          "minimum": 1
        },
        "height": {
          "type": "integer",
          "minimum": 1
        },
        "exif_orientation": {
          "description": "EXIF/TIFF orientation (tag 274) of the stored image, 1-8. Every other pixel quantity in this sidecar -- width, height, intrinsics fx/fy/cx/cy, distortion_center and the roi points -- is expressed in the grid the file's pixels are STORED in, with this rotation NOT applied. It is recorded because a phone held portrait writes a landscape sensor buffer tagged 6, so a reader that honours EXIF (cv2.imread does by default; PIL's exif_transpose does on request) decodes a transposed array while the intrinsics still describe the untransposed one. Nothing in the record made that detectable: the mistake produces a plausible measurement rather than an error, on every capture, in the same direction. The alternative -- stripping the tag at write time so no reader can rotate -- was rejected because it makes every capture display sideways to the humans reviewing the dataset and discards which way was up.",
          "type": "integer",
          "minimum": 1,
          "maximum": 8
        }
      },
      "required": [
        "path",
        "sha256",
        "width",
        "height",
        "exif_orientation"
      ],
      "additionalProperties": false
    },
    "depth": {
      "description": "LiDAR depth map for this capture, or null when depth was unavailable (TICK-023 AC5). Absence must not cost an entrance.",
      "type": [
        "object",
        "null"
      ],
      "properties": {
        "path": {
          "type": "string",
          "minLength": 1
        },
        "sha256": {
          "$ref": "#/$defs/sha256"
        }
      },
      "required": [
        "path",
        "sha256"
      ],
      "additionalProperties": false
    },
    "intrinsics": {
      "type": "object",
      "properties": {
        "fx": {
          "type": "number",
          "exclusiveMinimum": 0
        },
        "fy": {
          "type": "number",
          "exclusiveMinimum": 0
        },
        "cx": {
          "type": "number"
        },
        "cy": {
          "type": "number"
        },
        "distortion_table": {
          "description": "Radial lens distortion lookup exactly as the camera delivered it: magnification factors sampled evenly from the distortion centre out to the farthest corner. Recorded verbatim and never applied on device -- undistortion belongs to the metrology library (TICK-042). ARCHITECTURE section 2 lists this as part of the method's legal input; it had no field until TICK-028, which meant no capture could carry it and Arms A and A-prime could not undistort a single tap.",
          "type": "array",
          "items": {
            "type": "number"
          },
          "minItems": 2
        },
        "distortion_center": {
          "description": "The point the table is radial about, in the same pixel grid as cx and cy. Recorded separately because it is NOT the principal point: substituting cx and cy biases precisely the frame-edge corrections the table exists to make.",
          "type": "object",
          "properties": {
            "x": {
              "type": "number"
            },
            "y": {
              "type": "number"
            }
          },
          "required": [
            "x",
            "y"
          ],
          "additionalProperties": false
        }
      },
      "required": [
        "fx",
        "fy",
        "cx",
        "cy",
        "distortion_table",
        "distortion_center"
      ],
      "additionalProperties": false
    },
    "gravity": {
      "type": "array",
      "items": {
        "type": "number"
      },
      "minItems": 3,
      "maxItems": 3
    },
    "card_placement": {
      "enum": [
        "vertical",
        "ground"
      ]
    },
    "roi": {
      "type": "object",
      "properties": {
        "threshold_top": {
          "$ref": "#/$defs/point"
        },
        "threshold_bottom": {
          "$ref": "#/$defs/point"
        },
        "card_corners": {
          "type": "array",
          "items": {
            "$ref": "#/$defs/point"
          },
          "minItems": 4,
          "maxItems": 4
        }
      },
      "required": [
        "threshold_top",
        "threshold_bottom",
        "card_corners"
      ],
      "additionalProperties": false
    },
    "ground_truth": {
      "type": "object",
      "properties": {
        "rise_in": {
          "type": "number",
          "description": "Threshold rise in inches, read from the caliper at the entrance."
        },
        "instrument": {
          "type": "string",
          "minLength": 1
        }
      },
      "required": [
        "rise_in",
        "instrument"
      ],
      "additionalProperties": false
    },
    "conditions": {
      "type": "object",
      "properties": {
        "distance_m": {
          "type": "number",
          "exclusiveMinimum": 0
        },
        "lighting": {
          "type": "string",
          "minLength": 1
        },
        "surface": {
          "type": "string",
          "minLength": 1,
          "description": "Optional since D-034: the plain-photo protocol never asks an operator to record it, so a screening capture that omits it is a record with a gap rather than a guess in it."
        },
        "occlusion": {
          "type": "string",
          "minLength": 1
        }
      },
      "required": [
        "distance_m",
        "lighting",
        "occlusion"
      ],
      "additionalProperties": false
    },
    "split": {
      "enum": [
        "dev",
        "calib",
        "sealed"
      ]
    },
    "capture_device": {
      "description": "The AVFoundation device type actually opened, e.g. builtInDualWideCamera. Recorded because the bare 1x wide camera delivers no calibration data on either team phone (TICK-020) and so cannot have produced any measurable frame -- a sidecar naming it as the device would be describing a capture that could not have happened.",
      "type": "string",
      "minLength": 1
    },
    "zoom_factor": {
      "description": "videoZoomFactor at the shutter. Required to make the D-014 claim checkable rather than asserted: on builtInDualWideCamera the scale is relative to the ultra-wide, so 2.00 IS the 1x main lens and 1.00 would be ~120 degrees of ultra-wide. Without this number the two are indistinguishable in the record.",
      "type": "number",
      "exclusiveMinimum": 0
    },
    "capture_mode": {
      "description": "Which kind of record this is, and therefore which fields it must carry (D-034).\nmetrology: the pre-registered study -- caliper truth, ROI taps, card placement, intrinsics.\nscreening: the 2026-09-01 plain-photo protocol -- entrance and condition tags only.\nimported: a photo taken outside this app, so none of our capture metadata exists for it.\nAbsent means metrology, so every sidecar written before this field existed stays valid.",
      "enum": [
        "metrology",
        "screening",
        "imported"
      ]
    }
  },
  "required": [
    "capture_id",
    "entrance_id",
    "captured_at",
    "device_model",
    "image",
    "depth",
    "conditions",
    "split"
  ],
  "additionalProperties": false,
  "$defs": {
    "sha256": {
      "description": "Lowercase SHA-256 hex digest (hashlib.sha256().hexdigest()). Uppercase is rejected so a hash has one spelling in the manifest. Anchored with (?![\\s\\S]) rather than $ so a trailing newline is rejected under both Python re and ECMA-262.",
      "type": "string",
      "pattern": "^[0-9a-f]{64}(?![\\s\\S])"
    },
    "point": {
      "description": "Pixel coordinates [x, y] in the full-resolution image.",
      "type": "array",
      "items": {
        "type": "number"
      },
      "minItems": 2,
      "maxItems": 2
    }
  },
  "allOf": [
    {
      "description": "A metrology capture carries everything the pre-registered study needs, INCLUDING the full condition set. Absent capture_mode means metrology, so this also holds every pre-D-034 sidecar to its original contract -- conditions.surface included, which is why it is restated here rather than left to conditions.required.",
      "if": {
        "anyOf": [
          {
            "properties": {
              "capture_mode": {
                "const": "metrology"
              }
            },
            "required": [
              "capture_mode"
            ]
          },
          {
            "not": {
              "required": [
                "capture_mode"
              ]
            }
          }
        ]
      },
      "then": {
        "required": [
          "lens",
          "capture_device",
          "zoom_factor",
          "intrinsics",
          "gravity",
          "card_placement",
          "ground_truth"
        ],
        "properties": {
          "conditions": {
            "required": [
              "distance_m",
              "lighting",
              "surface",
              "occlusion"
            ]
          }
        }
      }
    },
    {
      "description": "A screening capture may carry what our camera knows, and is not required to: the phone that carries the depth device has never been through the capability probe (D-032), and a capture protocol that fails outright on a device delivering no distortion table would lose the entrance rather than record it. What it may NOT carry is a caliper reading, a card placement or ROI taps -- the protocol places none of them, so a value in any of them would describe something nobody did.",
      "if": {
        "properties": {
          "capture_mode": {
            "const": "screening"
          }
        },
        "required": [
          "capture_mode"
        ]
      },
      "then": {
        "not": {
          "anyOf": [
            {
              "required": [
                "ground_truth"
              ]
            },
            {
              "required": [
                "card_placement"
              ]
            },
            {
              "required": [
                "roi"
              ]
            }
          ]
        }
      }
    },
    {
      "description": "An imported photo was taken outside this app. None of our capture metadata exists for it, and inventing any of it would put a measured-looking value on a record that never measured anything.",
      "if": {
        "properties": {
          "capture_mode": {
            "const": "imported"
          }
        },
        "required": [
          "capture_mode"
        ]
      },
      "then": {
        "not": {
          "anyOf": [
            {
              "required": [
                "lens"
              ]
            },
            {
              "required": [
                "capture_device"
              ]
            },
            {
              "required": [
                "zoom_factor"
              ]
            },
            {
              "required": [
                "intrinsics"
              ]
            },
            {
              "required": [
                "gravity"
              ]
            },
            {
              "required": [
                "card_placement"
              ]
            },
            {
              "required": [
                "ground_truth"
              ]
            },
            {
              "required": [
                "roi"
              ]
            }
          ]
        }
      }
    }
  ]
}
