{
 "capture_id": "E-061-3602-p",
 "entrance_id": "E-061",
 "captured_at": "2026-09-04T20:11:41Z",
 "device_model": "iPhone 17 Pro",
 "image": {
  "path": "E-061/IMG_3602_processed.JPEG",
  "sha256": "0bbbc03167d99893f3fc09a013c4117c2ef5a3f5d43f135af875407ee520153f",
  "width": 4284,
  "height": 5712,
  "exif_orientation": 1
 },
 "depth": null,
 "conditions": {
  "distance_m": 2.5,
  "lighting": "direct sun",
  "occlusion": "none"
 },
 "split": "dev",
 "capture_mode": "imported"
}
