{
 "capture_id": "E-011-3278",
 "entrance_id": "E-011",
 "captured_at": "2026-08-31T21:14:12Z",
 "device_model": "iPhone 17 Pro",
 "image": {
  "path": "E-011/IMG_3278.JPEG",
  "sha256": "aea71016b1c3f3b0593127b5ec0e3adb66c2b7f352c8977d85bb39bc6c09ec4f",
  "width": 1536,
  "height": 2048,
  "exif_orientation": 1
 },
 "depth": null,
 "conditions": {
  "distance_m": 2.5,
  "lighting": "direct sun",
  "occlusion": "partial"
 },
 "split": "sealed",
 "capture_mode": "imported"
}
