{
 "capture_id": "E-025-3398-p",
 "entrance_id": "E-025",
 "captured_at": "2026-09-04T19:54:58Z",
 "device_model": "iPhone 17 Pro",
 "image": {
  "path": "E-025/IMG_3398_processed.JPEG",
  "sha256": "91e56fe593b4b3bd7128034c99a7e346550f2de4e3420a4fefd83f72b1250cd8",
  "width": 4284,
  "height": 5712,
  "exif_orientation": 1
 },
 "depth": null,
 "conditions": {
  "distance_m": 2.5,
  "lighting": "direct sun",
  "occlusion": "none"
 },
 "split": "calib",
 "capture_mode": "imported"
}
