{
 "capture_id": "E-003-3229-p",
 "entrance_id": "E-003",
 "captured_at": "2026-08-31T21:08:42Z",
 "device_model": "iPhone 17 Pro",
 "image": {
  "path": "E-003/IMG_3229_processed.JPEG",
  "sha256": "633b11d248d73654907ebba418528535f3ca4485093e1e3f927a8e4c834a2192",
  "width": 1536,
  "height": 2048,
  "exif_orientation": 1
 },
 "depth": null,
 "conditions": {
  "distance_m": 2.5,
  "lighting": "direct sun",
  "occlusion": "partial"
 },
 "split": "dev",
 "capture_mode": "imported"
}
