{"capture_device":"builtInDualWideCamera","capture_id":"3F2504E0-4F89-11D3-9A0C-0305E82C3301","capture_mode":"metrology","captured_at":"2026-09-02T14:22:31Z","card_placement":"vertical","conditions":{"distance_m":2,"lighting":"overcast","occlusion":"none","surface":"concrete"},"depth":{"path":"3F2504E0-4F89-11D3-9A0C-0305E82C3301.depth","sha256":"ded32129b05bfc16ce501e654a169960583352cbc974824ed16ce94855904386"},"device_model":"iPhone17,3","entrance_id":"E-014","gravity":[0.02,-0.98,-0.19],"ground_truth":{"instrument":"digital caliper","rise_in":0.75},"image":{"exif_orientation":6,"height":3024,"path":"3F2504E0-4F89-11D3-9A0C-0305E82C3301.jpg","sha256":"41e5787e9f28562d07b891b1816b492309d646c0f2829743fa4963a9f9cc1d61","width":4032},"intrinsics":{"cx":2037.2,"cy":1499,"distortion_center":{"x":2016.4,"y":1512.7},"distortion_table":[0,0,0,0,0,0,0,0,0,0,0,0,0,0,0,0,0,0,0,0,0,0,0,0,0,0,0,0,0,0,0,0,0,0,0,0,0,0,0,0,0,0],"fx":2792,"fy":2792},"lens":"builtInWideAngleCamera","roi":{"card_corners":[[900,1500],[1100,1500],[1100,1620],[900,1620]],"threshold_bottom":[1012,1480],"threshold_top":[1010,1400]},"split":"dev","zoom_factor":2}